Customer Review,Emotion
Alhamdulillah berfungsi dengan baik. Packaging aman. Respon cepat dan ramah. Seller dan kurir amanah,Happy
"barang bagus dan respon cepat, harga bersaing dengan yg lain.",Happy
"barang bagus, berfungsi dengan baik, seler ramah, pengiriman cepat",Happy
bagus sesuai harapan penjual nya juga ramah. trimakasih pelapak ??,Happy
"Barang Bagus, pengemasan Aman, dapat Berfungsi dengan Baik",Happy
"barang bagus, seller ramah..",Happy
mantap paten joss,Happy
"Works fine. Respon seller cepat, barang berfungsi dengan baik. Recommended.",Happy
barang bagus.. segel.. utuh.. original.. berfungsi dengan bener.. seller respon nya ajib.. cepat amir... uda gt kasi sarannya pas banget lg dengan kebutuhan.. mantabbb,Happy
Barang datang dan berfungsi dengan baik dan terlihat bagus kali ada lampu birunya.,Happy
"Pengiriman super cepat, barang bagus, recommended seller, thanks",Happy
alhamdulillah barangnya udah nyampe... d coba bagus... semoga awet... terima kasih seller kurir dan tokopedia...,Happy
"Penjual amanah, responsif. Kabel berfungsi baik. Pengiriman cepat. Terima kasih.",Happy
"Alhamdulillah barang sudah sampai, bisa dipakai semoga berfungsi dengan baik dan awet, kurirnya baik smoga rezekinya lancar terus",Happy
bagus. berjalan baik dan cukup silent. kokoh dan muat untuk laptop 16 inch,Happy
